userId,userName,date,url,score,title,text,replyDate,replyText
104625806695460337725,Vaibhav Potdar,March 7, 2016,https://play.google.com/store/apps/details?id=com.bslamc.fingo&reviewId=Z3A6QU9xcFRPRzI1dzZSUE82RTdaRTJ0RE1KSnB1bkhfWXB3eXpxZ2pFbE96LTB6TzNOVHZBNnNwNkgtWlJBbkdMb1hvdWo0dExLV3o4b0hwY2hqc1dOa1Bj,1,Unable to login. Worst app,Even having existing online account, I am unable to register or login. Tried reinstalling didn't work.,March 14, 2016,Your existing login for the customer portal works on the app.  Pls write to connect@birlasunlife.com regarding the exact issue you are facing.
104786307494436696995,Deepak Shankar,March 6, 2016,https://play.google.com/store/apps/details?id=com.bslamc.fingo&reviewId=Z3A6QU9xcFRPRlRSaHFDbktBcDlvcDBNMDVUNnM2UzIwc3M5OTZTQzBHY09GY0lDdDVtT2xmSUQzTlIyTEJEVDQ4MDZRb0FCMW9OLWpVMlh1a3BxWWIxOEZZ,3,Too slow,We have multiple folios unable to access other accounts and interface is too slow,March 4, 2016,The app uses an email based login. All folios having the same registered email ID will be available. Do write to connect@birlasunlife.com in case you are facing any issues on this
111671600911729591878,Mana Ran,March 5, 2016,https://play.google.com/store/apps/details?id=com.bslamc.fingo&reviewId=Z3A6QU9xcFRPRkVCMVhXRi1LeXJSRUw1ZHlGTjh6ak5mOXFKSzlsMHZhQjhlTTNQVE0yRUY0X09NM2hfRkpmcThQOG1EMjNIZnlsaWptWldUdGNpWWM5U29Z,5,One of the best in industry,Awesome experience. Light and quick, got all my login and investments in a jiffy. Good one. Had no login problem whatsoever. :)  very user friendly design. Happy happy experience. Each user gets what they deserve,null,null
117976294498053718220,Perala Chakravarthy,March 4, 2016,https://play.google.com/store/apps/details?id=com.bslamc.fingo&reviewId=Z3A6QU9xcFRPRUsxUnJfTU9ycFpIVkpnQW1SV2N6eGppTEtGQmQ5cG5NMXZYNGEzX3AzaEgzWWtTcDlaNHEwaXMtUktoQXBHZzFqQnpZUFlZZ2JvMmxzOWM4,1,Srini,Not able to register. And also not able feed email to get registered,null,null
108972743701212368748,shashank jain,March 4, 2016,https://play.google.com/store/apps/details?id=com.bslamc.fingo&reviewId=Z3A6QU9xcFRPRlAwRWJ1LXRnLW5EUElUamc2czJpWlU1LXc3WDl3QnJVZHdVNFdsdHVsVlFDYVRnOGdieGxBNlNiQWJUbF94c2Q4bFVySS1hdHVNQUJkaTdZ,1,Needs bug fix,It does not take alphabets as input. I am not able to input user id and password.,null,null
109933495518721465796,Sneha Kadam,March 4, 2016,https://play.google.com/store/apps/details?id=com.bslamc.fingo&reviewId=Z3A6QU9xcFRPSEE0TjNIZUJtSHpjU1oyV0w0Uk4temJUSE5WdWFZVmw3cml4MFVYcmdnRGo4LUMweU1uNnhQT2dZT3ExYndFMTNRZmFncUVMcVk0VmtpTVhV,5,,Very good app,null,null
116066827230028227375,anandkumar madireddi,March 3, 2016,https://play.google.com/store/apps/details?id=com.bslamc.fingo&reviewId=Z3A6QU9xcFRPRjJIb09aVGhtUjlTNVZ3cy1mTUFHVFQzVEx2Z2tBVFVIWmltWm03T3ZvTmxZdDRiSi1mWFdMVktaRFN5NWhoMld4VXVtYTRjN0xDdzJmdmFZ,1,,Worst app,null,null
100107555259853085308,MLN SARMA,March 3, 2016,https://play.google.com/store/apps/details?id=com.bslamc.fingo&reviewId=Z3A6QU9xcFRPSGdhazhubzMxdlZWX3FncW9va052NFJ6YjR1THBqa1BDQUE0SXozV0FsUld6dEJ4VFozRi1NSFVjVzFESjZQOWphMHlRSFY4clJOZkw2aFBB,1,,MOST WASTE & WOREST Password doesn't work. If you enter a new password even if it's  10 characters, it says minimum 8 characters required. Single star also WASTE.,null,null
116293730889287379390,Debasis Jena,February 29, 2016,https://play.google.com/store/apps/details?id=com.bslamc.fingo&reviewId=Z3A6QU9xcFRPRkotYWNIcE9hdldweVdtMk90cjN5d19aVDNXazdKZXVuZGFDNXZjNVFwWnpXa2lncmpVdmVLSVNKTVpPQ01QekotNEJhWmptZUF0MTdDVWxN,5,,Cool app,null,null
113785608175439210275,Amit Jiwani,February 29, 2016,https://play.google.com/store/apps/details?id=com.bslamc.fingo&reviewId=Z3A6QU9xcFRPSDZIZlJENjFWUlZMaU80U2pyM3VrVWhQTngtT0V4bHJlcHktdVNJRDg5Q3R1N3RRRFAzUnZtMzR6TVlwaXM2SXkyUEpZeURhNWJtTnNXRmdB,1,Worst experience ever,I am yet not able to log in I have downloaded this app for the past month. I don't know what to put so that I can log into my account. I m trying register only but every time I register and I get the otp but after inserting the mpin and password it does not go ahead.,February 29, 2016,Existing folio holders can register using their email ID.  If you are using our customer portal, your existing credentials used on the portal will work.
115825410771676925271,som krmkr,February 29, 2016,https://play.google.com/store/apps/details?id=com.bslamc.fingo&reviewId=Z3A6QU9xcFRPR2dfM3lpWmdPMHlhY3poYy1hWFc5cklIc3hIU2pmRDNTc1BabDRrbVZfQ21VOVFnSE1zblJlV0JJbUdZRjZncGZnWWdQalhQWF81azJzdmkw,1,,Worst app not working,February 29, 2016,Thanks for sharing your feedback. Pls write to connect@birlasunlife.com regarding the exact issue you are facing.
114556527843611193054,Kewal Kumar,February 27, 2016,https://play.google.com/store/apps/details?id=com.bslamc.fingo&reviewId=Z3A6QU9xcFRPSHc3c0pmNmZvUTJzV3k5WXYyVkJFWER3ZHNkR1Z0UnV6ZEF4ZmdrWHM4dmJILTlfNmM0OUx3UzZ1M244RGxNWW1QU21iYTFmNmZHaXlaS0pR,1,,Failed to register always saying password not match,null,null
105176035724773681359,Manas Sikchi,February 23, 2016,https://play.google.com/store/apps/details?id=com.bslamc.fingo&reviewId=Z3A6QU9xcFRPR3ZNcDdfbEdyRzBTajJZbmlZSENoVlNWOFZxeWl5ZDNCcldfYTd2Z09HbGZHZllGdnVEYnotTXlzVVJTSmVrUjhDc2tJZWxXLWJOVXEtOUlV,1,Not able to register,Even after trying to register couple of times... after generating OTP... it says UNABLE TO REGISTER. TRY AFTER SOMETIME.,null,null
108047527318659961532,prasad risbud,February 22, 2016,https://play.google.com/store/apps/details?id=com.bslamc.fingo&reviewId=Z3A6QU9xcFRPR3paOVlfdFF2VmVWQ2NadmkzNktTOFR4SzRISlRYaVNHLS04WjU0OVlKZlIzSlk3NGFZM2pNSnl3eHBQN3lXUHRidmJmbldxNHRTV0sxVGtB,1,Prasad Risbud@Note3,Not able to login. Just stucked after putting login details. Waiting for long time but it is if no use. West of time and data too. However works fine in Firefox window   guys do something.,February 29, 2016,Thanks for sharing your feedback. The intermittent slowness problem in the app is resolved. You will be able to login quickly. Pls write to connect@birlasunlife.com in case you face any problems.
113836909959073690739,dharamveer bharti,February 22, 2016,https://play.google.com/store/apps/details?id=com.bslamc.fingo&reviewId=Z3A6QU9xcFRPSFM0S3g4eUlEV2RLY2J0Q3pJdWRPai04MmV3WGpkTFhRRFI5VW5KWHdsNThySkVpTVc2eGpaQ0Jza1pnbTduMWlGNkQ4WjU1OHQ2N0VublZR,5,Good for investors,Nice app hassle free transaction for investors...,null,null
109594034383522239026,Amit Kumar,February 22, 2016,https://play.google.com/store/apps/details?id=com.bslamc.fingo&reviewId=Z3A6QU9xcFRPRldja2hNa0NlOFdESUNJOEgwN0I0aEJUZ0VUVjBaMm1JTFRqcGNqWFB1RFowclExcGJmUzdGZFJ6YVpYNklGcW80cWhUN1dBbzBrVUNYS1NB,1,,Trying to install it from 2 days but in vain!,February 22, 2016,Pls write to connect@birlasunlife.com regarding the exact issue you are facing.
100016786238008978839,,February 21, 2016,https://play.google.com/store/apps/details?id=com.bslamc.fingo&reviewId=Z3A6QU9xcFRPSEFMeUhOZUZhSGV5QWVZSjBTMzRCWmxIbnZsRF91Wk1yRTdLeFg1T19uLTVBZDAtY0RXV3NuVDBjMk5wcWhlS3owd3Nyc0xsYXRSTm41Z2JZ,4,Best in Best,Nice app.... Only 1 draw back is that  app is not smooth.,null,null
103916073973448634342,Nagendra Reddy,February 18, 2016,https://play.google.com/store/apps/details?id=com.bslamc.fingo&reviewId=Z3A6QU9xcFRPSGJLdXlfdVU1eHFubkVraHh0MFRqaVA4dm9CTzl0Y09tckxvNDNIWnpFMERtYWp2dEV2NG9sclFWTXh5enBMUFRQMHc0NUVWaXNVVlRQUFU0,5,Good.,I could create folio easily...,null,null
109018680868962017943,avdhesh maurya,February 18, 2016,https://play.google.com/store/apps/details?id=com.bslamc.fingo&reviewId=Z3A6QU9xcFRPSFhJalhnQV9rRnBveVVOVXROM0dkNk5YY3BBa2ZHVzBvVUplaWRHb2JUcWthblkxb3hhd1AyOV9HSlBUaUd0RXRmM0JlcDZGV0V3YVp6YjhF,2,Doesnt work!!!,My account, new account, no keys respond...  Had to ununstall it,February 19, 2016,Thank you for getting the issue to our notice. We sincerely apologize for the inconvenience.
We have encountered this issue in some devices when predictive text has been enabled. We will be releasing a fix for this shortly.
In the meantime, we would request you to please try again after disabling  Predictive text.
107547824871508475324,deoraj patel,February 18, 2016,https://play.google.com/store/apps/details?id=com.bslamc.fingo&reviewId=Z3A6QU9xcFRPRlRYRmRkRW1IRDFZTVEzdnpZdjVQbHR1WFlwTEllN0xhaGh0ZW11T1JYOGpHeXpjWmQ2T1Z4VFJrQ2hqcnJCRVMtbGt2S1pRVm0yaFlDdm5N,3,,Download problem error 492,null,null
108828566602233461645,Utsav Parekh,February 18, 2016,https://play.google.com/store/apps/details?id=com.bslamc.fingo&reviewId=Z3A6QU9xcFRPRkZiTEwzTVI5VFFMYllLVThLYUhLOGJoejQ2LUJ1Z011c2RfLWZoY2VEc3lNQ29YdXpZSE9aSWFLaDRRbmw2NmJFNHNjci0wallyMV9ua0hv,1,Cant able to login only,After many time otp has generate its unable to process further even at step 3when password I put in it. Pls check what's the problem is going.,null,null
userId,userName,date,url,score,title,text,replyDate,replyText
103788699393741320436,Dr.Venugopal K,February 18, 2016,https://play.google.com/store/apps/details?id=com.bslamc.fingo&reviewId=Z3A6QU9xcFRPSGx2cS1Uc1d4eEFtTEJCT3o5UkY3VE9UVzRkbE1CVE1HcVFoNy1fdHdVc3V2UktPbmFDQVltTU1Qb3RXR2NuS1JwOXBzZjZjTnVTbmRJXzRN,4,K VENUGOPALAN,After so many tries, I could finally register and use the app. There is further scope for improvement.,February 18, 2016,Thank you for getting the issue to our notice. We sincerely apologize for the inconvenience.
We have encountered this issue in some devices when predictive text has been enabled. We will be releasing a fix for this shortly.
In the meantime, we would request you to please try again after disabling  Predictive text.
105009099089046682531,SN N,February 18, 2016,https://play.google.com/store/apps/details?id=com.bslamc.fingo&reviewId=Z3A6QU9xcFRPSHpiVGNYM0pSWUpvX01BWVpWU3UtNk43ZEhlSlg1Sm1EdU83M0tPdUx5c3QyWWNheUN4WmxENWdlUWk2Y2ZwTGtQRDFGOUI1XzJfbkpiamFv,4,Slick,Clean interface, and design. Good value adds. No clutter. Look forward to what fresh updates may have on offer.,null,null
109024884304685981055,Saravanan P,February 18, 2016,https://play.google.com/store/apps/details?id=com.bslamc.fingo&reviewId=Z3A6QU9xcFRPRnF1eER3dUpOVE5aV1B0SmpIR2lTcmo4NWNzNmpuNzZvLXJiT3REdjlYdGNRa0RqWTE4Nm11aE9PRVFLU0FvcEtWLWtsdl8zb1ZVUkJoTDhB,1,,I have installed and registered also. But attempted to login and failed. I have received your reply but unable to understand what exactly you are asking me to do. You are asking to disable ....... text. I dont understand.  However, i am touched by your courtesy of answering to the customers.  But be genuine. Do not give the same story to every customer.,null,null
106550432152061534843,Jobin Kalayil,February 18, 2016,https://play.google.com/store/apps/details?id=com.bslamc.fingo&reviewId=Z3A6QU9xcFRPRVVnZkJhSTN4c3l6RU5QWGtNY0J1SlZJcm8tZFMwYWdBdng5S0thS1Ntb29LZ0JpV1JfX0RSYjh5S09rV2FURE1XeV8wWWt4UExjWWdNQWww,1,,Needs lot of improvement! !!,null,null
105574868430329497059,Sudhir Modh,February 18, 2016,https://play.google.com/store/apps/details?id=com.bslamc.fingo&reviewId=Z3A6QU9xcFRPRWdJdjktcGYzM0UydHF4OUZIUjNhMGN0alhUZjJKOE91YnN0SGJ5MUpGY1VxaWZheHB2ekVKbHY1eHdoRURkVnpJdGtCSjFBZ3ZpOHotdVE4,1,Not working,I can login in my PC by using my id and password but not in this application.,February 29, 2016,Your existing credentials of the customer portal will work. Existing folio holders can also do a fresh registration using their email ID. Pls write to connect@birlasunlife.com in case you face any problems.
112958043315246612247,Dheeraj Prasad,February 18, 2016,https://play.google.com/store/apps/details?id=com.bslamc.fingo&reviewId=Z3A6QU9xcFRPRlBUOF9hOTB6VU9UUGdiMHNxRlg1eDgwbGVOUkRtQVZrZy1Sd3gwZmhobHlxaUlCLUJDYmdkUmxmRnVpdWpJc1Rpc0lGYnl1cmRPUjBvVGxB,5,,Great App,null,null
114116581967284574668,Riashree D'Souza,February 18, 2016,https://play.google.com/store/apps/details?id=com.bslamc.fingo&reviewId=Z3A6QU9xcFRPR3paV1E1VTdPRlFXeXRjUkEtSVNKdFNTWUlTS0IwdFAybXZQLWRkS0w0Z1lkMDVrZ1NNdk1JVTd2NDEyQktOUi1BQ182MzItbDg4WGE0eG93,5,,Great app,null,null
103817209109337829407,Jibin Baby,February 18, 2016,https://play.google.com/store/apps/details?id=com.bslamc.fingo&reviewId=Z3A6QU9xcFRPSFQ5ZVNNbTRqX3pLOGctaWJ4SWFMaThQdDVpckdoQ25TZDVjeUFsbW5MZkc0OTVOSks4djltSF80bm1xOEVzZVNKM1RfRTA2MVFvOGdQakZB,1,Jibin,Tried to activate this. But, the message is 'unable to process... Please try after some time '. So, uninstalling.,null,null
111785294675955313680,paramjeet singh,February 17, 2016,https://play.google.com/store/apps/details?id=com.bslamc.fingo&reviewId=Z3A6QU9xcFRPR29ldUtRNFBLSzVYNERtWVJYNDNNazlCZ3gxd2JSYndNMFRJR0l0eHd5WnYxVXBkYWxkYzdtTXl1dTBBNEJieURvN19zT0gwTUpuUkxUek5F,1,Don't waste data or space,After successfull login & generate password & mpin . Its display " please wait " after try 5-6 times .. problem is same . I think its waste of time , data , & memory space . Useless 0 star,February 29, 2016,Thanks for sharing your feedback. The intermittent slowness problem in the app is resolved. You will be able to login quickly. Pls write to connect@birlasunlife.com in case you face any problems.
108144177234959996914,Narendra Patni,February 17, 2016,https://play.google.com/store/apps/details?id=com.bslamc.fingo&reviewId=Z3A6QU9xcFRPRlZnbEVFV2VuVFdhSzVQUlFzVUJGYm1mNGxfVVRoOFg2UU40Zms4UGw3VVNaTkZKMjlRcjFnMXRnTnp0TXJ3UWZhQmFhSGZqZUFkZVE4cWI4,4,,We expect more in this app !!,null,null
103334986635998828774,pradeepkumar nadaf,February 17, 2016,https://play.google.com/store/apps/details?id=com.bslamc.fingo&reviewId=Z3A6QU9xcFRPRWRrWWpRcEF0Nlg5bVYxNnZZQ3p4WE8yVkhieXRqTnpXc0xjMU1qX2NwZWxvSTNucFlJRW5WYnRva09JeDd3SGhLQjZhMDVpSUd1aWhjZVFn,2,,No mail id can be typed,February 18, 2016,Thank you for getting the issue to our notice. We sincerely apologize for the inconvenience.
We have encountered this issue in some devices when predictive text has been enabled. We will be releasing a fix for this shortly.
In the meantime, we would request you to please try again after disabling  Predictive text.
116652357222600706977,Virendrasinh Gohil,February 17, 2016,https://play.google.com/store/apps/details?id=com.bslamc.fingo&reviewId=Z3A6QU9xcFRPRVE3LTUwRWtoUlhSVVF1SkMyMkdtZFJDR1VVRW9xY0NFN1A2ekJ2YkJRQ1NPdm1SWEFUbmJqMnVxWGFTM3MyNlV6anN4U3I5bW1zSDZ1NTZn,5,Virendra,Make it more smooth.. Gets lot of to download.. Very good app,null,null
117698264835131114904,Pratik Lunagariya,February 17, 2016,https://play.google.com/store/apps/details?id=com.bslamc.fingo&reviewId=Z3A6QU9xcFRPSGU2LUgwWjVtSm1aeHpNXzAxQWxOMEo3SzFsMVIzSEZ2TmMycUdGZF8wbUtmM1cxSHplMTNCUEZmUFJPVmwzR0xLMzdiRzhfeUEwekJtQ2FZ,1,,Very bad app. I can not open account worst application,null,null
106088473610768454076,Abhijeet Patil,February 17, 2016,https://play.google.com/store/apps/details?id=com.bslamc.fingo&reviewId=Z3A6QU9xcFRPR2lhM2lVa3dadDBWUGEtU0FpdXFvY2JlekVXb2RsOVRYd2ZrYnd6UU1EdlVzMWh1UlhORk55VEExSzNkWWZ3RUNqUWdjTk04YVNTYnVxZGxF,1,Worst application I have ever seen,Not able to register or able to login with my user is id and password which used to login in BSLMF portal. I am uninstalling this now.,February 18, 2016,Thank you for getting the issue to our notice. We sincerely apologize for the inconvenience.
We have encountered this issue in some devices when predictive text has been enabled. We will be releasing a fix for this shortly.
In the meantime, we would request you to please try again after disabling  Predictive text. BSLMF portal credentials will work
118225576196647547101,biru pakhya,February 17, 2016,https://play.google.com/store/apps/details?id=com.bslamc.fingo&reviewId=Z3A6QU9xcFRPRVdFOHZtZjhHTjVaRVFYYVJwSERJOXE1a0RtaUxCS21Sd1FTRDhoZHdEN3o0VVpaTnJuRGZJVWdtZlEyTS1uelV6TmJfSWRPZzZuUFZJLWtZ,5,Nice,Thank to Molly kapoor,null,null
100562752823169260045,Lakshmi Panja,February 17, 2016,https://play.google.com/store/apps/details?id=com.bslamc.fingo&reviewId=Z3A6QU9xcFRPR1NzZmFpVzBmeU80eVB3SUhMU09JM29xSGhScTFyWlBrMDF5bS1pd1ZTcWhSQVZiaDRuQXdLMW5seEI2cS12MWtMQUpBQ2FjcXI4dzltbVNV,1,Disgusting,Can not register.entering email address but the same is not reflecting.only 2 characters are reflecting.also when using the login option there the password is taking the first 3 characters. pathetic.,February 18, 2016,Thank you for getting the issue to our notice. We sincerely apologize for the inconvenience.
We have encountered this issue in some devices when predictive text has been enabled. We will be releasing a fix for this shortly.
In the meantime, we would request you to please try again after disabling  Predictive text.
112633964054368598165,KOTI RANGARAO Suraparaju,February 17, 2016,https://play.google.com/store/apps/details?id=com.bslamc.fingo&reviewId=Z3A6QU9xcFRPSHN2UFZoMU9NVWJ2RmVvczhPLXVRNE4xcWVMVHpYUi1pSHRCYXl4MFh0OVB4anl0TVBlZzlRM19aTDNIM2d1azY1Mk9hU21KeUlZTVdQVHpv,1,,Not able to access or register.,February 18, 2016,Thank you for getting the issue to our notice. We sincerely apologize for the inconvenience.
We have encountered this issue in some devices when predictive text has been enabled. We will be releasing a fix for this shortly.
In the meantime, we would request you to please try again after disabling  Predictive text.
114123947563718457004,Girish Aithal,February 17, 2016,https://play.google.com/store/apps/details?id=com.bslamc.fingo&reviewId=Z3A6QU9xcFRPR0Z1WTlObFF0T2dpVG84S0pDRGpzRENzN0NLN0pkd1FkWVBXUlJWbDBvc3dHc1dTSTRDUkx0ZkRHUHhTc1lIakZGMUNVZmRqTlA3blVHVWJR,2,Unable to register,Error - 'Unable to process ur request. Pls try again' after entering d MPIN n password.,null,null
100097045901834604787,Amit M,February 17, 2016,https://play.google.com/store/apps/details?id=com.bslamc.fingo&reviewId=Z3A6QU9xcFRPR2lyM21JR2dWRTNXN2JXRm5aS2dQUFdQU0w3LVFFVmU0OWdrWGpobzNsLS1sU1JScDFZbFo3a3BxT2l6VFNwN0NsRTNFVGkteVhrYUdHMEVF,4,Excellent start,Good app. Somehow it says that i am not allowed to transact. Not sure why. Had no issues in registration and login. Look forward to checking the transaction feature next.,null,null
106580272016674085708,KAUSHIK BHAR,February 17, 2016,https://play.google.com/store/apps/details?id=com.bslamc.fingo&reviewId=Z3A6QU9xcFRPR0tBRWxMc2FoYWQ1ZUNWZ0RHNndLSnVOLU9ld2FGQzU2em9ncS04dkNkdXAtRXRZdmJieGxVb3BZZk9RbW5TY1FFT2J3VEc2QW1IVGtUaFZ3,4,Good attempt,I liked the app. Good use of colours and ease of access on tabs. Password entry could have been better though.,null,null
116128433829481429200,Raj Kumar,February 16, 2016,https://play.google.com/store/apps/details?id=com.bslamc.fingo&reviewId=Z3A6QU9xcFRPR2h5a3N1WDI5R2RDc0QwSVBMRGRZeUZ3TnJlaGJYNV9CNlFMZWFCM0EwMDZoQ254TG5FOUxXLXR4Y1ppMWg5MkJwbkRjWFN3YkU0bklkTVJJ,1,,Not possible to login because this software always asking enter correct password even though I entered correct password,null,null
115653171496000146644,Saurabh Arora,February 16, 2016,https://play.google.com/store/apps/details?id=com.bslamc.fingo&reviewId=Z3A6QU9xcFRPR2E4dWxNNV9iNDkweEhYdndualB6a25RVXd4MzRFcW04bi0tT2dPbzZSNnFCdG9hU0NuN0wtUUhzbzQ0SjNoYTNVVWxfMDc5SVlpWjBGcm5F,5,Mutual Fund,Best mutual fund App. Very user friendly... It's truly MF on the go,null,null
112623824105280633050,Jackie Ganatra,February 16, 2016,https://play.google.com/store/apps/details?id=com.bslamc.fingo&reviewId=Z3A6QU9xcFRPRWd0eF9UMTFRRjdpNElROFZPazl4cDRldXpFM2lTV1JpYnJFTnBjTXE5eHdxQlVXNzJKWkItckJkNElKZ1Z6M2FDOUFzakdUd2FyQXJKZ1h3,5,,Nice and user friendly,null,null
115773769108306998808,Mayank S,February 16, 2016,https://play.google.com/store/apps/details?id=com.bslamc.fingo&reviewId=Z3A6QU9xcFRPRl9QdUVGT255aDRsdlJvOG9DSEhaUi1PWHdkb3lfMldnZGxIVXk0bGlLbnB5bHlSSHFjZUxZYWQybFJTZXZaVkczcmR0ZmMzSlF2QURXNzAw,5,,Great App! Able to time the volatility on the go with the help of FinGo!,null,null
113604136829287423200,Vishwas Heathhcliff,February 15, 2016,https://play.google.com/store/apps/details?id=com.bslamc.fingo&reviewId=Z3A6QU9xcFRPRmJHdTFxQjcyWTJ1WTM4NEM0c3dYcGhaeVpTb3lQUTdkZDMxTFF3WU1FZTR0VHZVNnBFZTVBMGtieEtDX0IzdFFDYTRyMW5ZejA4THpDYW1B,1,Can't even log in!,That's really bad. You come into the game so late and yet so unprepared. The password field doesn't accept certain special characters, such as #.,null,null
102031007511841331530,Bhawani Shanker,February 15, 2016,https://play.google.com/store/apps/details?id=com.bslamc.fingo&reviewId=Z3A6QU9xcFRPSGk0VUFxdHVkaDhKd19wWmtnWEUyZzJWbm85MmJkRks4Nk1ucjFOMDNvVDFweHI2QzBCWXl0c0U5ZTZiY3lSY2pmZU0waUdHVEUtYXE5eFFR,2,,Not able to login , very slow,null,null
103682819906618106713,Udayakumar Palani,February 15, 2016,https://play.google.com/store/apps/details?id=com.bslamc.fingo&reviewId=Z3A6QU9xcFRPR3RROHNuUjB5UHNuSWRKbHpVQ2RMN2xQdXBaQW9lMU10X2hGUHBZWWN4YWIyRnpZei1SVnFLT3dsQVRkM3U5QmZYUGIta1hXOERPbzJmNEww,3,Additional purchase,Not able to do additional purchase through app. It says "transaction not allowed for this folio number". Also when I tried to post a query through the app, it doesn't allow me to enter the email id fully. Look into it.,February 16, 2016,Thanks for your feedback. Pls write to connect@birlasunlife.com for the issue related to transaction in your folio.  We are working to resolve the issue regarding post a query on priority.
109013311833516423005,Inderjit Singh,February 14, 2016,https://play.google.com/store/apps/details?id=com.bslamc.fingo&reviewId=Z3A6QU9xcFRPSGdXTnU2M1p0dFdBelY1eHNrQXVRWmYwTy0zSFBjcWpENmZybXM3YUg2Yl9mbkdkbzhoSFA0d3c0ZEpBWE9GVEVSVGQ1ZjU1TUJzZUdJZEhF,2,Kidds app,Very backward app to online mitualfunds even cant put  e mail in registration page,February 16, 2016,You need to use the email ID registered in your folio. Pls write to  connect@birlasunlife.com in case you face any issues.
113631306222483056631,Harish Nayak,February 14, 2016,https://play.google.com/store/apps/details?id=com.bslamc.fingo&reviewId=Z3A6QU9xcFRPRVN0RGRUSk1NUkJGZHJ0UHpWSlh6VFoybThRRzRhQlZsNjNFeFJfTkc5S1IyTzgyUXVFem1tUE1kTFA4eFZ3LXAyV1lZOEhWb1VRM2tSUHRB,3,,Great expectations from BSL AMC. Not getting otp for registration by SMS,February 14, 2016,The OTP is sent by email only. We are working to display the correct message. Pls write to connect@birlasunlife.com  if you are not able to register
115154263557246487818,Subhajit Ray,February 12, 2016,https://play.google.com/store/apps/details?id=com.bslamc.fingo&reviewId=Z3A6QU9xcFRPR041ZW1EaVduVlZhTTFRcldkSzFLbFhkd3YtV08zTzd2UlpkYmQzdDNuMElKOVpCYzlQakJuaEJ6a0NFVTl2LVJualRvQjlSdFJpeUcxMVZr,5,Super app from a super fund house,Super,null,null
110951935816087281067,Faraz Khan,February 11, 2016,https://play.google.com/store/apps/details?id=com.bslamc.fingo&reviewId=Z3A6QU9xcFRPRVhaWTFzOWNBWE11UXFtcTZaS2RpemxERFBrVVVXazVTemJOWnJBMTByaU41RWJLZllpR1BlNnZiMHVRVlhhVFFMcDAySFYxRG1KRFV3T1A0,5,Nice,Very user friendly application...,null,null
101999925581836808316,Vuppala Venkata vinod,February 11, 2016,https://play.google.com/store/apps/details?id=com.bslamc.fingo&reviewId=Z3A6QU9xcFRPRzR1UFB3YlN1a05qTjZmQ1M2RUhnamNSbFMtcDhZY3JnNDhab2ppN0NsVWtCRXB0V05JVFBUZEk2ZFhheV9sQTQzbGFvOU1DN3ZINUV5bXpB,5,,Need to have,null,null
110946241761895329966,Priya K,February 11, 2016,https://play.google.com/store/apps/details?id=com.bslamc.fingo&reviewId=Z3A6QU9xcFRPRnB0TDhvbEpxVGs0WHV0ZVh4Q082c3ZnVnRBMklTSXN1cUlueGI4WTR4ZnRSSFhSRVJFMk44VXNrREtBZDFiVXV2WTlkT2FPQ1dHdjd1Zkpz,5,,Great app with lot of features..,null,null
112279825538694890120,Rajan Devadasan,February 11, 2016,https://play.google.com/store/apps/details?id=com.bslamc.fingo&reviewId=Z3A6QU9xcFRPRTg4aXBYQ1RTWkhTaEVudjJuOXZlNWZoNC1QeTRjNzZhZXBZanZRcTExQjNLMkswR0wzN1p5RGc4V3IxXzR2OV9rLVJTQy13c3JzaTZQUjBj,5,Awesome app!,Packed with features for mutual fund investors.,null,null
115333921120672307213,Aalok Mehta,February 11, 2016,https://play.google.com/store/apps/details?id=com.bslamc.fingo&reviewId=Z3A6QU9xcFRPRkJhTllQdlBUTEVUNm5TU0E0WTk2d1lGLVg3VW85QmxXdXBSZF9tbmdrT0FTN0hwd1VzS1ZDZmc4YjhQN3JoOHM1eXpBa252dV9iaVllZjVV,5,,Great App,null,null
109872415476098048068,Debadatta Nanda,February 11, 2016,https://play.google.com/store/apps/details?id=com.bslamc.fingo&reviewId=Z3A6QU9xcFRPR3ViczFIMHFrQmowdFFqY3UwRjhoWktJaVBoaVUyM2N4ZlotOXlMNkluMTRPdjVzTkZJX3JDMkxlRFVvdi0ySGlIcjd5WkRscjZNX0g1WndR,5,Nice App,Very useful and nice app,null,null
105529726929320697771,Satyanarayana Reddy,February 11, 2016,https://play.google.com/store/apps/details?id=com.bslamc.fingo&reviewId=Z3A6QU9xcFRPRno0dEQzQ1pVVC13bVZBYWZZNDNJeDF2ejNDTndUUEhzbHNMVVFGOXRLbkxEYTNvMXFhOUprY3BIMjJEcW1scC1ZZjRuZ0hjdVEtWXJxZTQ0,5,,Awesome app,null,null
112774062696147065889,Priya Gandhi,February 11, 2016,https://play.google.com/store/apps/details?id=com.bslamc.fingo&reviewId=Z3A6QU9xcFRPRVduUGZiZmF5bml3dlpLYTlwQXJNdEZBdjBjMjVpX1dWOVNZVGd1Y3lxaW45Z2xGQ2M0Sm5rZjkyUEoyTzVTZ3N4LWpNMllSVDJmQUI4cXpJ,5,,Awesome app,null,null
110846170545459276551,Ananda Kannan,February 11, 2016,https://play.google.com/store/apps/details?id=com.bslamc.fingo&reviewId=Z3A6QU9xcFRPRlRSb012c0RzQU4yczJoaTZSeUttODE2SThGUG83aFRNY3pOTmxaWm9kS3V3aEpHaE5oUTRaVFN6VXhqekc0SUw5ZVVocjJfdmlUVE9VaktV,5,,Great,null,null
117833320277769709666,Jyoti Prakash Bhuyan,February 11, 2016,https://play.google.com/store/apps/details?id=com.bslamc.fingo&reviewId=Z3A6QU9xcFRPRTB5MHpTY1hHTFZ4cXVNSzRqS3U4T2JtY0RnVGhiZkxVckpfdkFSVHl4Wk1td1lnSUp5VVdITkNWZjVabFNnZ2JfTkVIUERtUmhRMDVSSUYw,5,Nice application...,Uses less memory than other similar apps...,null,null
userId,userName,date,url,score,title,text,replyDate,replyText
106718355228226057222,Rakesh R,February 11, 2016,https://play.google.com/store/apps/details?id=com.bslamc.fingo&reviewId=Z3A6QU9xcFRPRVVqOTFSZW5xTEZVSnZBSVN5S3VTWmJSOFoyMHB1OGNUUlBYT0JHVFRTVWV0TzAyM0ktUzhuMi1zeHlBeWhjU3NmLXkzM2dBR0daZDRYRHBB,5,Great app,Awesome app and very useful with most of the Mutual fund features..,null,null
userId,userName,date,url,score,title,text,replyDate,replyText
107578121885201607016,pratik patel,August 22, 2016,https://play.google.com/store/apps/details?id=com.bslamc.fingo&reviewId=Z3A6QU9xcFRPR09lbTVwX2luN0F5TlY3WUsxdXZHVm9YY2ZXVG1qX1ozWTFSNnNObWtacnlQdHVEMWJ5RmRHaVZwaC1vT2ZTX3VPMjJrbVFPaE10aUhJZFg4,1,Update apps,How much profit in % cannot show in Debt investment......so add function XIRR in apps,null,null
