userId,userName,date,url,score,title,text,replyDate,replyText
107068107364537104168,ravi Makhija,August 21, 2016,https://play.google.com/store/apps/details?id=com.bslamc.fingo&reviewId=Z3A6QU9xcFRPRTZMMUlfRnRjcmhVUjR1Q1dNYkRHNXl0alVxWm9tc0F6S0tzZVBOaDc0c3VhSEQyTVFsWVNXN2t1Yk9DVmF4ZDVqS2NZV1l4aUhuZXlYVG9n,1,Horrible App,Completely unresponsive, not intuitive at all. Needs to completely rehash thia app. Does not provide basic performance analytics of your portfolio.,null,null
109740198772343531513,Kamal Kriplani,August 17, 2016,https://play.google.com/store/apps/details?id=com.bslamc.fingo&reviewId=Z3A6QU9xcFRPSHRqUGE0cWxnRWYwVXBxWlRqMkNybW5QZzRjdV9vRjE5RExkLVpERTRSOTFwUElHWHdISE9YeW9QekU3U2F4ZW5xTWVZblpMMGFZdWMtNnI0,5,Kamal,Verry good,null,null
109967669809493447413,Mitesh Karia,August 17, 2016,https://play.google.com/store/apps/details?id=com.bslamc.fingo&reviewId=Z3A6QU9xcFRPR0FHWld0RXNmeTFUWjdJckttZEtfSWVlbE00cFlCS3hsQnNjYVZfeFNocVgzYnBIVEJuUXQxTlAyNVdPa3ZsUmNkN3F6WkU4UjRFR3BBQVpr,1,Useless,Haven't come across such a slow prehistoric app even in 2007 when smartphone were new, login doesn't work, registration doesn't work. Deleting it right now.,null,null
113620108066260787972,Abish Kabra,August 11, 2016,https://play.google.com/store/apps/details?id=com.bslamc.fingo&reviewId=Z3A6QU9xcFRPR0pSM1BCTW11Ul90dTNaeTVId2RzMWhxcS1LNHlWaUxBY2RmUU1sSVJ4MUM2VEs0UDVxRDRJS2lVaDRqeWdZTXdycHQxOTNCWm5zdEhmOTJN,1,Auto logout from a/c,Every time I open your App I have to login everytime in my a/c. this is my personal mobile, not a public computer. so you don't have to log out me after session timeout. I also have Reliance Mutual Fund and axis mutual fund app in my mobile. They don't auto logout me ever. once I'm logged in, I remain login for ever.,null,null
116402872470075444927,Mukesh Saharan,August 11, 2016,https://play.google.com/store/apps/details?id=com.bslamc.fingo&reviewId=Z3A6QU9xcFRPR2JtN2RLRjNVRjIxanQwVERfNVM0dk1jWl9pSWlCWVNMOUE0RG92WlQyRXQyX28wSDR2TWxBeXZzelhnMFpOUE95c2JlQzZqTlB6a1hGQjVR,1,Login not allow,When i try to login then its show unable to process. Plz solve this.,null,null
105910626955750276450,,August 10, 2016,https://play.google.com/store/apps/details?id=com.bslamc.fingo&reviewId=Z3A6QU9xcFRPSDVUWWFtVF90UzR5NUxhVlFPRVZuaFlVRGp0MUZMZlpqN2EzQVh5djZJcGczMXRRMUFLTmdJTmRRU2xQMy1nSWg3WFBuT3ZTQWpHclQ4amtr,1,Keypad Issue,Not able to put symbol like underscore in mail ID. Also not able to put special characters in password. Please fix the problem S.,null,null
102859526707031096873,Vijendra Singh,August 10, 2016,https://play.google.com/store/apps/details?id=com.bslamc.fingo&reviewId=Z3A6QU9xcFRPRTJDX1RFcXhPdVppSm1MVmNHSkpxR25KMTRrTGlaQjV4dVczUXNtT21SWU1wdUt6Z2plMFpCMlRRWk10SDdkX2dyNjZ5QXBWakh1NHlCSE5V,1,Keypad issue,Still Not able to input special characters in password. Pls fix it ASAP.,null,null
117431262534863152202,Shahid Ali Ansari,August 6, 2016,https://play.google.com/store/apps/details?id=com.bslamc.fingo&reviewId=Z3A6QU9xcFRPSE9zR2VwNXNWX1VvNUFfZ29iSkxQdVIxWUxNVEhpQmUtRDA2dnNGUlJzRHFQS2x6NmtFVDlFdnRDSGY4ZHpyR1MtdFhjaFE5X3EtSEJUY2c4,1,Worst app,Unable to login.why managment is not taking any action if most of users are doing complaint regarding same.,null,null
116837320912521892105,ranjeet singh,August 2, 2016,https://play.google.com/store/apps/details?id=com.bslamc.fingo&reviewId=Z3A6QU9xcFRPRkhCa3B2c1VUSEVTMXA5ZlJYX0R5d1lNR1FnYUoyY2phOW55Q0xGelZhRGhqQ3Eza3FOdDBBczRxR1FvbDd4SlN3eFhXR3dieHlsc3owWTNN,1,,Within all glittering app is the ugly UI which would not allow you to login  despite providing passwords pin ,etc.  Need to resolve these issues ASAP ... until then keep sticking to old platform i.e. desktop version,null,null
108203535856952665046,Anil Barnwal,August 1, 2016,https://play.google.com/store/apps/details?id=com.bslamc.fingo&reviewId=Z3A6QU9xcFRPRmg2bDl6UFBLSVZlXzZ6U1o3QXNXYUtEZWdrR2lFbTM4dEpfcWtGaUd6QUh4RzVBaC1UODJZMndEN3licEtvdXNwcE9vX01hSFZlMFlGV2JV,1,,Does not open at all,null,null
105195508209493530554,Gaurav Dubey,July 30, 2016,https://play.google.com/store/apps/details?id=com.bslamc.fingo&reviewId=Z3A6QU9xcFRPR3VzY1FNM25Sb2x3c3puNXI0QVFYNFhIY2daRlZEYUM4Uk9zUWx0WkFvaE5UeEVidzZYUkpWNVBnUlJiRjgzVXpUV3h1NXNPTXJQWkZsRENV,2,I am not able to register neither from app nor from website. Tried several times. Feeling irritated.,Please consider these trivial problems asap.,null,null
112846123136695368011,Shanmukha Sainath Addepalli,July 29, 2016,https://play.google.com/store/apps/details?id=com.bslamc.fingo&reviewId=Z3A6QU9xcFRPRW1pNUNRYXpFTVVubW9La3JYQVBSLVBXMEZfYVYxWjBxMjRvSi1va2sxWl9tejNsNjcwWkpIWlhfTmg2djNwMjhvM015UWJPSGVNRWlMTUxF,1,Unable to login.,When I try to enter symbols in password the keyboard switches back to alphabets. I can't enter my password and able to log in,null,null
100769496246412242432,Hiren Chheda,July 29, 2016,https://play.google.com/store/apps/details?id=com.bslamc.fingo&reviewId=Z3A6QU9xcFRPR1JjcUlfbmRSa2F5eEYyczJhOG5CYWQtQk5lTmF2ejVZSjRHSnhaQnBuU0M0QWtZaTFmQjE0SHY3cXlpNDdHTzV6QUdfeTM3dERxOExxYlBj,2,Wait till the cows come home,Slower than slow. Can't do things at this pace. It's 2016! Also, asked me update fatca, which I did 6 months ago. You haven't synced !,null,null
101885010266037742240,pradeep ratgali,July 20, 2016,https://play.google.com/store/apps/details?id=com.bslamc.fingo&reviewId=Z3A6QU9xcFRPSHFLaENpVTgwd0xlQ1FMSEIyallrYldSYnlCSU41ajdPVUNiSWNsTGhqLVlHa0o0aHdhWGhjMl9SUS1CQV9NWnFNcXJHV280bmdiVjlYOGgw,1,Improve please,Showing wrong NAV of fund,null,null
108932410644096475520,Birla Sun Life App,July 19, 2016,https://play.google.com/store/apps/details?id=com.bslamc.fingo&reviewId=Z3A6QU9xcFRPRV9vaEFLOHlpV09aVzJnX0NUQkxyQWdaYTU5QWNROU04Tm5oV0MtSklTd2dpcVItYjVSdkpaMGNPUERqMnItT1E1S2VjcVVTb2NCRzdrc3JF,5,,Good,null,null
116572711211467113756,Chirag Ganatra,July 16, 2016,https://play.google.com/store/apps/details?id=com.bslamc.fingo&reviewId=Z3A6QU9xcFRPSHRic1Z5V01UbGRxTi1oWVdQRXZUUG1tUXNSMjNWUURYVU1HYzJUT0NIODJOZXJCSUloak1fX0RlSlZrZ1V0MzQ3bDlrcTh1b1VSbGJTQS1J,5,Best app,Download it and use for purchase it's very easy to use.....,null,null
114125961653435322394,अनिरुद्ध Prasad,July 11, 2016,https://play.google.com/store/apps/details?id=com.bslamc.fingo&reviewId=Z3A6QU9xcFRPRVZJb2hFTUwwSl9qcFBYWGZFQ0RldC1zblF0YmpmbXc4UWhlajJlb3JrU1Bid3MzNWxkS2Z6RUptQ3lGbGR0WTZ3N0wwbklicWxLeHBsT3Nn,2,Keyboard issue,Correct it,null,null
116452559925048862108,sssssi100,July 9, 2016,https://play.google.com/store/apps/details?id=com.bslamc.fingo&reviewId=Z3A6QU9xcFRPSENqYXdfOE54VFhFSXl3OTNqaGlBek01ZFVaVFlkQ3RsZS1mUzZqRFZBSGI1TkRZMUF1T3FET1J4cWk0dXZxMUpaemFiTkJISWY5RkxPcUhz,1,Not able to login,From first day, not logging in after entering the details. However the website logins work swiftly. App is useless without login feature.,null,null
108023744191137797615,shivendra jaiswal,July 9, 2016,https://play.google.com/store/apps/details?id=com.bslamc.fingo&reviewId=Z3A6QU9xcFRPRVpQZ2NMYU5BZjk3QndGaTFVSDZrZkM3QzZyaUc4TUtxd1Bia3dacU1ta2xrNkZVdlJwOHZpYWs5bDBQNnJfdlgxc2p1enRqb3o4bmlhbGNV,1,What Rubbish,I cannot loging in App..i will cancel my sip now if not resolved by 11th july 2016,null,null
101433534156921480319,Gaurav Sahoo,July 7, 2016,https://play.google.com/store/apps/details?id=com.bslamc.fingo&reviewId=Z3A6QU9xcFRPRWVtd0hUU2NnMmZuYnFMNk4tZk5RRTlhMTVGekM4enB6WnlEYzlmeHU4d0k2YW9GTjhoTkdMMEhZTVJ3cGVBZmtSMktqSTVXbE83eGMzeC1B,1,Not sync with site ..,Don't show my folio also.. very very bad all,null,null
112354029763079157619,ASIS GHOSH,July 6, 2016,https://play.google.com/store/apps/details?id=com.bslamc.fingo&reviewId=Z3A6QU9xcFRPRXk2SFEzdENQaWpCZHVXRDhna0w0U2I3RlVCQlV4NXh6ZHB4QmVRMWNDLWFKVmh4V3d1Q054M242ckt4RGMzODVhcFlqUVVqMzRxejE1Wnd3,3,Required modification,Pleases arrange for provision of edit, change and remove option on "Set Favourite" at "Quick transact" mode on your app.,null,null
106869679428236162090,Himanshu Savsani,July 4, 2016,https://play.google.com/store/apps/details?id=com.bslamc.fingo&reviewId=Z3A6QU9xcFRPSDZ0cFhmbEZPV1I5bGpsenJOWG9fZE1ld1ZEMXJONFhOU2pQeWc1dUNTZjBFU0ZSMjRNLTA0dC1aTF9WVGtkUEpZVEtZMnhiTUNGZ3FtZEVN,1,Worst,Unable to register even though I have folio...,null,null
114257930237982089887,Bhavishya Goel,July 3, 2016,https://play.google.com/store/apps/details?id=com.bslamc.fingo&reviewId=Z3A6QU9xcFRPRVBjanVjYWlKaEY5SzFpR0RBMjBqLWhoeEQ1TUN1bnM3WmRXNG1JWmVEODVkWkZnS0hwR05mVVlHbmM1N2dKWVhham1Qb2xPNWFQaWFtOU1J,1,Useless,Never seen an app as useless as this.,null,null
116971296105196744477,Nirmal Walke,June 22, 2016,https://play.google.com/store/apps/details?id=com.bslamc.fingo&reviewId=Z3A6QU9xcFRPR3g3emJIMXVWNHBIU25ldTRST055YWdrTFVyX1lTQ3JSanFiVkxOQVJWN2wyLWc0d2g3emV6M1EzLW1aQ05IQVhmZERfY2Q3TG1xYllnc0dJ,3,Please implement access token,Add the option to login using Facebook just like on the website. Also don't ask user to login each time app is opened.,April 6, 2016,Your existing login for the customer portal works on the app. Folio holders can also register for a email based login by using their registered email ID. Pls write to connect@birlasunlife.com regarding the exact issue you are facing.
108410658725729061199,Yash Jain,June 15, 2016,https://play.google.com/store/apps/details?id=com.bslamc.fingo&reviewId=Z3A6QU9xcFRPRmtySkZSV1BQcHBoemVoZEYwSER6cVJMSjQtZXViaFhRSXRsSGJVSnhsczZWbmtQeXdWMlllRmwweVhKQ1RPR2lzTlRFT1ZOQ0lMNU1vdndj,1,,I didn't like the app.. compared to this CAMS app is better,null,null
117180268642011807913,Alok Tripathi,June 15, 2016,https://play.google.com/store/apps/details?id=com.bslamc.fingo&reviewId=Z3A6QU9xcFRPRlpjNTB3RXBZNXduckw1VGFMal9OLWJpZHdjOTRrTGZOU1RXOW9BSGg2aDI4YUtDb1ctdkE4TFAwQzJBYmR0MklCdVlIS0JObkdIbUtDSFU0,3,Mismatch in calculation,Four folio, and it's showing wrong amount in every folio. Please have a look on priority. Invested amount is shown lesser than the actual invested amount. Who moved my money?,null,null
110113014818559702493,kvvkoteswara rao,June 12, 2016,https://play.google.com/store/apps/details?id=com.bslamc.fingo&reviewId=Z3A6QU9xcFRPSGl2cmVETHJXUEdMX1B2RFV0MUIzT180RFdKd1RtbmhlMmhmVzNlNXppRTdwSDNGb1BBTmMxWE1qRTZDVHhtWnZIVDEzX3VjUGpiOXlhZXlr,2,app is failing to fetch  data of my account,I have a folio with sip;But the app always replies "Not allowed for zero folios",June 13, 2016,Kindly write to connect@birlasunlife.com with details of your folio and the issue you are facing. We'll make sure the issue is resolved.
107521725894744250255,ritupon deori,May 27, 2016,https://play.google.com/store/apps/details?id=com.bslamc.fingo&reviewId=Z3A6QU9xcFRPRk8xdmxJN1hZb1RlTEZVSU5GMGlrZ0JNU2F5anVUSFBjWlN3MVhNY21qM0lDNm52UzJ3bE93TVY3NS01bm10dGRTV3hEeTJtaUl1MjB3ODdZ,5,i can't login,i got my folio number today. But how do i register to use this APP. Now the customer support has solved my issue, thank you,May 27, 2016,Thanks for your feedback. Please register using your Email ID. You can go to My Account -&gt; Register , put your email ID and generate password. Once your email ID is registered, you can login with your email ID and password.
100947086716861393846,Abhishek Mehrotra,May 21, 2016,https://play.google.com/store/apps/details?id=com.bslamc.fingo&reviewId=Z3A6QU9xcFRPR1FyR05SSmNsVEl2blNDX2tmVE5RNGpHRlZNZlQ0aWhBLWQ0dEh4R01qWVF0Q1BrNksyNjNXeUxBU2dBVlg4dzJMTHpZRnJBRkR3TGk1STkw,1,,Unable to login,May 27, 2016,Thanks for your feedback. Please register using your Email ID. You can go to My Account -&gt; Register , put your email ID and generate password. Once your email ID is registered, you can login with your email ID and password.
107466986980253495116,Being Patriotic,May 17, 2016,https://play.google.com/store/apps/details?id=com.bslamc.fingo&reviewId=Z3A6QU9xcFRPSDJQd0VIR3JuZnV1MTA2ODFiRm8xZGxRWHQtdHg3Ny1KemZUdU14NnNKZ0E1UnZ3WUpVbjFYdXR5a3dIR1Rkdkt4S3ZBcXctS3B6aWM1NzBJ,1,Poor app,The major issue with this app is login problem.I have tried many times to login but every time this app shows an error that your data is not registered.Every time I got an otp on my registered email ID but not received on my registered mobile no. And then when I further process for my password change it shows a same error.Is this your service to the enduser. Sorry to say that if this is your service I may force to switch to other AMC which give a Hassel free service to their customers.,May 19, 2016,Pls use the email ID registered on your folio for registration. The OTP is currently sent to your email ID during registration. For transactions the OTP is sent to both your email and mobile. Kindly write to connect@birlasunlife.com regarding the password change issue you are facing. We will resolve it asap.
109620964380391540672,Akhter Mohiuddin,May 14, 2016,https://play.google.com/store/apps/details?id=com.bslamc.fingo&reviewId=Z3A6QU9xcFRPRkY1dGNCLTduTmYtVjQwQXl4OE9sdzRMUW0tMURVdTFidHhCaHRPV1Z5VEVPU2hMU1lRU3loSGJZLUxmZ2JBc25vOTlFckZhYUM1WTljWDdv,2,Keypad issue,While typing password, the symbols keyboard isn't coming even if I invoke it. It seems the basic keypad is fixed, how do we type special symbols or characters.,May 19, 2016,Thanks for your feedback. We have noticed this issue for users using Google Indic keyboard and are working to resolve this issue. Pls use the Google English keyboard as a temporary workaround.
102857478539012401333,Amit Kulkarni,May 11, 2016,https://play.google.com/store/apps/details?id=com.bslamc.fingo&reviewId=Z3A6QU9xcFRPR2IyT3FDZG93OFpwRW9oYXp5eHB4QU1IQXdEeWU3aldiUHlSVFhTZE5UeExZMXh3Mk95OHFWa1lwWFl1ZG9nWU8tZ0JEWHoyU3dPVGpXUm5V,1,Worst app,10th fail developer,null,null
116610155021124787936,Kaviarasan ATM,May 11, 2016,https://play.google.com/store/apps/details?id=com.bslamc.fingo&reviewId=Z3A6QU9xcFRPSFRkMWhvZndiTGdyMG1fZS1vdUExbVljU0lkZDNzcjltaGNOaW42T3ViX0JHS09RSThoS3d5WXdEa0Fvb0Z1aTM5aWNqVThjQlJpdS1PZnVJ,1,,Can't enter password.. fix keyboard issue,May 19, 2016,Thanks for your feedback. We have noticed this issue for users using Google Indic keyboard and are working to resolve this issue. Pls use the Google English keyboard as a temporary workaround.
105501979122251881739,Ajay Sharma,May 6, 2016,https://play.google.com/store/apps/details?id=com.bslamc.fingo&reviewId=Z3A6QU9xcFRPRW94czJCZUVpOG10VnpYYl9LWGd0QmdIajVlYjJDaHNtUkhEWm45Yl9fZ1FHUER3TmExMXJOVnZJbndZTFlKSUZlc3JUWmNtQ0FYUFZYallv,1,Useless App,Special keys do not work,May 19, 2016,Thanks for your feedback. We have noticed this issue for users using Google Indic keyboard and are working to resolve this issue. Pls use the Google English keyboard as a temporary workaround.
118115306962237234623,Vimal Babu,May 2, 2016,https://play.google.com/store/apps/details?id=com.bslamc.fingo&reviewId=Z3A6QU9xcFRPRk5IMW1uaHIxdWdHelJIcG92VVJQa056UFhPNW5RUFdFNGxDUnRPTlpVWUo1QUdLaldfbjZBYnhoMjRGeGszQVhGT1dQMGZGc2JicWEza29z,1,Login issue,I cannot login. It shows user already login when I type password.,May 4, 2016,Thanks for the feedback. We have noted this and will make changes to improve your experience. When you face this issue, pls try to login after 30 mins. Another option available in the app is to register afresh for an email based login. You will not face this issue when using the email based login. Kindly register for an email based login.
117185323891126240372,akhil gupta,May 1, 2016,https://play.google.com/store/apps/details?id=com.bslamc.fingo&reviewId=Z3A6QU9xcFRPSFJvX2tvMjhWemJMR2tkTTk1cVhmYXZSMHZoLU5YcjNpLWFsa3F0alYwR1lSQnlpeUZLUGQ2NHhzRHRaZ2plVzBIejc1QkRkUEpPc0c2SzZV,1,Worst App,One issue that I have faced is in the login since the first day it would give error that user is already logged but in actual it isn't which is faced even when access ing the site ,which I was not facing prior to installing the app. Even the customer care don't the solution and then I mailed at their email I'd and yet to get any solution but it seems to be a technical issue with app itself as I can see the same review from others also.,May 4, 2016,Thanks for the feedback. We have noted this and will make changes to improve your experience. When you face this issue, pls try to login after 30 mins. Another option available in the app is to register afresh for an email based login. You will not face this issue when using the email based login. Kindly register for an email based login.
107713806277469157265,abhishek bhonge,April 29, 2016,https://play.google.com/store/apps/details?id=com.bslamc.fingo&reviewId=Z3A6QU9xcFRPR2lySlJkVVBqNi1vR21kN3kwZHlRaldHcmY1QmpPZ05wUms4Xy03c3dweXNXdTRpNlppbG9tREtaZElkTWNnWkw1amc4SzItUHExdGczUjFZ,5,Good step,All funds houses should have app like this,null,null
112385913606845719327,Dr Prabhat Tandon,April 22, 2016,https://play.google.com/store/apps/details?id=com.bslamc.fingo&reviewId=Z3A6QU9xcFRPRW1fejUwbkJHNklyNGYtei1HLUpBZkI5N0dWZU9pb1Z2ZkNPUWRrQzJ5VHV2U1RidlpORWVVcmtzZnBkak1HMUVmZmw5cE1HWGRDT3Y1ajRn,1,Worst app,I am transacting regularly through web on birla portal successfully . But this app gives me the worst experience . Every time I log , the message comes up , " no user data found with this email id , try with another one .",April 25, 2016,Kindly write to connect@birlasunlife.com with details of the issue you are facing. Pls mention your folio number and login ID.
110540236991269905101,Ki.shore Chamria,April 22, 2016,https://play.google.com/store/apps/details?id=com.bslamc.fingo&reviewId=Z3A6QU9xcFRPR1VuRXhuUERxNTJaSlNwbWZmUU8zMTA4bkNJb1VVdndrOHFnLWRiZWFLckl6V3loNUsxLTdDTldydUpncmdsU1ItajJJY1dIRlQzRVozY0xJ,5,Super app!,Investments never had been so easy with lots of convenience. Great app.. thanks BSLAMC,null,null
userId,userName,date,url,score,title,text,replyDate,replyText
112095229759923417584,PRASAD DESHPANDE,April 16, 2016,https://play.google.com/store/apps/details?id=com.bslamc.fingo&reviewId=Z3A6QU9xcFRPSC1heGFDMWZ5YjBFcUdjZHB3ekdXRzNpS3FNS0w3ZmxBWTN5a1BhQTVaYTZYSkdDRXhVUzViVWxwdkpLeUVyZnZ1cy16M3FIcEh4dm93SmRv,3,,When Distributor  Ap will come. Exact date shortly waiting month on month.,null,null
116293230840902579379,Suraj Vashishat,April 13, 2016,https://play.google.com/store/apps/details?id=com.bslamc.fingo&reviewId=Z3A6QU9xcFRPSFQzZXA3aEs4d3UzbnlzaVIyQlpYNFNKUTA4QmI2dVkycWFEd3hGR1lIcTM4QnBKTW5EN010QlNrMHNIakJwWkFjbzhtRUppdEh4bkx5Nklz,1,Worst app ever seen,Not able to login not picking alphabets not able to register,null,null
111003594419499910532,navneet vaja,April 12, 2016,https://play.google.com/store/apps/details?id=com.bslamc.fingo&reviewId=Z3A6QU9xcFRPRjJDVjFOMS15Sk93Zzc0RWNfNnpSdHc1NnJsN09HZXhLUnJQYmNHRjNDdG82UnFaaldneE5lazg4Z2RXLXlhRlhHaklsUEoyQzkzZHUzT1E4,1,,Poor,null,null
112532856360282144022,Vahid TV,April 11, 2016,https://play.google.com/store/apps/details?id=com.bslamc.fingo&reviewId=Z3A6QU9xcFRPRTg2cXdfMzdHSWhNWWdmdjVKOVZidF9wQkZyald6RGc4TDRON0E1WDQ3RFNWNnBaS0I3cEVCZURMaWw4MDhLX1NoZktNSzY5NkJRbzZqTlJv,1,,Not able to log in. Always say you are already logged in.but actually not.please fix it.,null,null
104901733327511093223,Ram Iyer,April 8, 2016,https://play.google.com/store/apps/details?id=com.bslamc.fingo&reviewId=Z3A6QU9xcFRPRUtzb0FERGtvTUJQM3dTOE0wcmEyTjlBZGh5S0R2RTA5WXFNOFFRVTdiVEFfR0VENFZPZ3ZLVEkteFQ5enZxNW9RVjNkYjI4M3NzTmk5VEpB,1,Worst experience,The welcome screen comes and frozen nothing happening. Samsung s6 edge. Unacceptable from atleast BIRLA,null,null
100869314465462410178,Sri Kanth,April 7, 2016,https://play.google.com/store/apps/details?id=com.bslamc.fingo&reviewId=Z3A6QU9xcFRPR0RIbDg1TVZtQV9UNUJnYUVLNGZFYlNoampEV2JVRGtHb1lYRTdybjhGaFBQSXEwVFhkMGJnMXJ5QXc1TUlrcVRROFRadngwZzVVeGU0TXVR,1,Nothing works,None of the links work on one click,null,null
117842878495549750671,Saday Kumar Singh,April 7, 2016,https://play.google.com/store/apps/details?id=com.bslamc.fingo&reviewId=Z3A6QU9xcFRPRnc1Ylo5VWdqbFRZdE01VV9lZ293NzgxejZNeWRaSTA0QTY1N1JBMUpmWm5WYVRtTk9DVEtaT3FmUndUZEoycGRJYl9ZQ1ZnbjRjYloyeEpV,3,Unable to login for 2nd time,After closing the app unable to login again. It is saying " An existing session has been detected using the same login credential. You have the option to cancel your login or log off from the existing session." Even unable to login from web. Kindly Help,null,null
108493844125974201543,Vijeyta Singh,April 6, 2016,https://play.google.com/store/apps/details?id=com.bslamc.fingo&reviewId=Z3A6QU9xcFRPRXZ6Y0xNYm1maEFKd3cyU1pibDVkYm9mT2pXQWVQbk0zOEkwRDZqSGxQWnBRZ2g0S215UEhrU241c1Z4c0d2QWFCdkFndFZ4VlFvNjNkaGdV,5,,Nice app,null,null
118337020053599912073,Lakshminarayana M K,April 2, 2016,https://play.google.com/store/apps/details?id=com.bslamc.fingo&reviewId=Z3A6QU9xcFRPR2VacFJnNHpUR3p6WDRPdE9ZUzloX3dPQmpRdjBwMUUwM2dnS21TeUxYbC04UUo0R3FPandRUXFOZTE2bUM4cTdYOGVVREdHS2pqNFlEVkcw,1,Very very bad app,Lot of errors when tried to relog after logout it is showing already logged in and go to logging in page worst,April 4, 2016,Thank you for getting the issue to our notice. We sincerely apologize for the inconvenience.
You might face this issue in case of connectivity issues or if the app is terminated. Kindy try to login again after 15 minutes.
We have noted this issue and are working to enhance the customer experience.
102468002697824907265,Rohit Singh,March 30, 2016,https://play.google.com/store/apps/details?id=com.bslamc.fingo&reviewId=Z3A6QU9xcFRPSGtZa2I1b3FEcGtCeHpVQnhQTXpFaWtzZ3RySC1rMHhxcVczN3dmZjBiZGxKOFFiZ2xTYWN4ZlQ4U0lldUNKRnlMZm9yMVNYOFk0blVLaUtR,1,App not tested,I am unable to login to my account through this app as I am unable to type alphabets in the username/password field. Only number and special characters are visible in the fields. This app has not been tested properly, please fix this asap. I am not sure how secured this app would be for performing transactions.,April 4, 2016,Thank you for getting the issue to our notice. We sincerely apologize for the inconvenience.
We have encountered this issue in some devices when predictive text has been enabled. We will be releasing a fix for this in a few days.
In the meantime, we would request you to please try again after disabling  Predictive text.
101793095275988381978,MAHESWARI AMBI,March 25, 2016,https://play.google.com/store/apps/details?id=com.bslamc.fingo&reviewId=Z3A6QU9xcFRPSExzVU44T1IxVW9xUFY2Tkt4YTlaWTNZSHJ3dUpSTjB4TUtRalg4Q2NrbnA3Z193dDNBd0FKbnN5OVl6NDk2V2tSeXJmTWN2SmRPY1pSYVZn,1,Worst,Lot of tech problems.. it's doesn't take the content wen we type. Up wish I cud give no stars. I think this is they work in mutual funds as well,null,null
115576946949053479777,Indrajeet Agrahari,March 23, 2016,https://play.google.com/store/apps/details?id=com.bslamc.fingo&reviewId=Z3A6QU9xcFRPRklJVXhiWGxhQXpJYmlaQUxQOWJKdGVCNnVBS0JkTlQtOVItMVBueFNnXzg0emkzUFRyOWo5bm8yYzh4T200Qk4zQ3U3UElCdGxObk93QVBN,1,Use,I,null,null
107920732859146741135,Yogesh Laddha,March 22, 2016,https://play.google.com/store/apps/details?id=com.bslamc.fingo&reviewId=Z3A6QU9xcFRPR3MyM19CdndQQkRTRldVVTVDelhCcF9hSHhDRVVQVHdadlo4Y2ZwbTlLZnplR1NjRXpUdmJmejE4OGJKcl9SeFFuazhkcU96NWR4NXBrdkh3,5,Good,Good Design & Function.,null,null
106589482880844773993,arun poreddy,March 22, 2016,https://play.google.com/store/apps/details?id=com.bslamc.fingo&reviewId=Z3A6QU9xcFRPSFZrSFNUU2JKUXNZRXZmdHNlSXQ3WWlEbFl3QlIwajVGeTNObmwxa1l4TEMyZ2hDYWRWa2JaNUEzTUZ3bFhVdm53UDNmaEY4Vlh4WDNtTUtR,1,Worst app ever seen,This app doesn't even tested properly the basic stuff .when I give credentials it's not taking,null,null
114659382315260570865,వెంకట సతీష్ కుమార్ నేలనూతల,March 20, 2016,https://play.google.com/store/apps/details?id=com.bslamc.fingo&reviewId=Z3A6QU9xcFRPR0F2ZVd3T2RTZldyYjVGa3hLdWppdW9Ud0ktVTBIM2lBRnFiVTVkQXFKcVdqRlVIMHh1ckpoc01kNDhLUWtoR2kxajFOU3JmRDR2Y2Vtb2tB,1,Worst App,I am not able to type anything. How can they miss this bug in testing.,March 21, 2016,Thank you for getting the issue to our notice. We sincerely apologize for the inconvenience.
We have encountered this issue in some devices when predictive text has been enabled. We will be releasing a fix for this in a few days.
In the meantime, we would request you to please try again after disabling  Predictive text.
106140114789799565349,Ashutosha Nadkarni,March 12, 2016,https://play.google.com/store/apps/details?id=com.bslamc.fingo&reviewId=Z3A6QU9xcFRPSDJXci1YNC1MNG10Ump5YXpKSGZ4RHpndnkyM3BLRnllazk0N1RqQXFMUjhiTFIxQ3pZcUd5UHMzZktRaWdJVlR0YjRQRnpwbnMxLUttcFpR,1,Can't login,Nothing gets typed when I try to enter user id .  After first character, can't type.,March 14, 2016,Thank you for getting the issue to our notice. We sincerely apologize for the inconvenience.
We have encountered this issue in some devices when predictive text has been enabled. We will be releasing a fix for this shortly.
In the meantime, we would request you to please try again after disabling  Predictive text.
115110066789898827777,amit pal,March 11, 2016,https://play.google.com/store/apps/details?id=com.bslamc.fingo&reviewId=Z3A6QU9xcFRPSDl4UDd6ZjRsYkdnV244enotQXNDX1JlYV9rRktNTjNNdDNJWlFKTG1LcVNXd2JaLU5sVC1JZVBaQnh4SGt4UU93ZndvOC1xNDM1RTBKam53,1,Worst app,One of the worst app I have seen in my life,null,null
103567474981168153074,Diwakar Mamidiaplli,March 10, 2016,https://play.google.com/store/apps/details?id=com.bslamc.fingo&reviewId=Z3A6QU9xcFRPRjdmdWpRQm9BM0NPNndVVGtFNHlxa29tb0ZpTlBkTm1VZ2xXRVRmWDJ5SmxBTm5JT21wNmo0MWlXVUFMekExZHRDSU82VXZBMjMzSUNFRmJj,5,Good,Good app......,null,null
100888487211372286945,N.S.KIRANKUMAR KUMAR,March 8, 2016,https://play.google.com/store/apps/details?id=com.bslamc.fingo&reviewId=Z3A6QU9xcFRPR3gwUEFacENtMEVIX0o5VlJmV2JQOS15SktQV254a2tCMER5c3ROZHNxTzV0ajZIdjVYalRVYmVENkE5UHE0YTlxaHpGN3lrYXE1Y05qS21J,1,,It is not helpfull for distributors there is no NFO information,null,null
